{
  "schemaVersion": "v1",
  "plane": "execution",
  "operation": "hyperliquid.perp.order",
  "requestId": "req_20260218_0008",
  "correlationId": "decisionbot_cycle_9008",
  "idempotencyKey": "hl-perp-order-0001",
  "timestamp": "2026-02-18T02:47:00Z",
  "intent": {
    "market": "BTC",
    "side": "buy",
    "amount": "0.002",
    "price": "market",
    "slippageBps": 50,
    "leverage": "2",
    "reduceOnly": false,
    "tif": "Ioc"
  }
}
