{
  "schemaVersion": "v1",
  "plane": "execution",
  "operation": "hyperliquid.cancel",
  "requestId": "req_20260218_0011",
  "correlationId": "decisionbot_cycle_9011",
  "idempotencyKey": "hl-cancel-0001",
  "timestamp": "2026-02-18T02:47:00Z",
  "intent": {
    "venue": "perp",
    "market": "BTC",
    "orderRef": {
      "type": "oid",
      "value": "123"
    }
  }
}
